Bold Text,Description
a or an before H?,"Use an before a silent H: an heir, an hour, an honest politician, an honorary consul; use a before an aspirated H: a hero, a hotel, a historian (but don’t change a direct quote if the speaker says, for example, “an historic”). With abbreviations, be guided by pronunciation: eg an LSE student"
A*,(A-level and GCSE) not A-star
A&E,"accident and emergency; in the US, it’s ER (emergency room)"
abattoir,
"Abbas, Mahmoud",president of the Palestinian Authority
abbeys,"take initial cap, eg Westminster Abbey"
Abbottabad,city in Pakistan where Osama bin Laden lived and died
abbreviations and acronyms,"Do not use full points in abbreviations, or spaces between initials, including those in proper names: IMF, mph, eg, 4am, M&S, No 10, AN Wilson, WH Smith, etc.Use all capitals if an abbreviation is pronounced as the individual letters (an initialism): BBC, CEO, US, VAT, etc; if it is an acronym (pronounced as a word) spell out with initial capital, eg Nasa, Nato, Unicef, unless it can be considered to have entered the language as an everyday word, such as awol, laser and, more recently, asbo, pin number and sim card. Note that pdf and plc are lowercase.If an abbreviation or acronym is to be used more than once in a piece, put it in brackets at first mention: so Association of Chief Police Officers (Acpo), seasonal affective disorder (Sad); alternatively, use the abbreviation with a brief description, eg the conservation charity the RSPB. Remember that our international online readership will not necessarily be aware of even well-known UK abbreviations. If an organisation is mentioned only once, it is not necessary to give its abbreviation or acronym.Cap up single letters in such expressions as C-list, F-word, “the word assassin contains four Ss”, etc"
"Abd el-Fattah, Alaa",British-Egyptian democracy activist jailed in Egypt
abdicate,"renounce high office abnegate renounce privileges, deny oneself abrogate repeal, abolish arrogate take or claim (something) for oneself without justification"
abjure,renounce adjure urge
Aboriginal Australians,"should be identified by their country or language groups at first mention if known, eg a Wiradjuri-Yorta Yorta man, a Noongar-Badimaya woman – or take your cue from how they identify themselves. The term “Aborigine” is outdated and offensive; Aboriginal should only be used as an adjective. Indigenous Australians is an umbrella term that covers both Aboriginal people from the Australian mainland and Torres Strait Islanders"
abortion,"Use  pro-choice ,   not pro-abortion; and use  anti-abortion , not pro-life.  Anti-choice can be used when talking about opposition to all reproductive rights, including abortion, birth control, family planning etc.In reference to US legislation,  six-week abortion ban  is preferable to foetal heartbeat bill, unless quoting someone talking about the “heartbeat bill”"
abscess,
absorb,but absorption
"Abu Akleh, Shireen",a journalist for Al Jazeera who was shot and killed in the West Bank
abuse,"see individual entries on  child sexual abuse ,  domestic abuse/family abuse  and sexual abuse"
abysmal,
abyss,
Academy Awards,"or  Oscars individual awards are lowercase, eg best actor award, Oscar for best pictureAfter first mention, abbreviate the Academy of Motion Picture Arts and Sciences to the Academy"
a cappella,"Italian for “in the style of the church”, ie unaccompanied singing"
Acas,"the Advisory, Conciliation and Arbitration Service, at first mention; thereafter just Acas"
accents,"include the accents and other diacritics, where possible, on words written in Latin- script languages such as French, German, Portuguese, Polish, Spanish, Turkish, Irish and Welsh, especially the names of people and places. But do not use them in anglicised words and names such as cafe, smorgasbord and Zurich (exceptions to this are exposé, lamé, résumé, roué). For a list of anglicised placenames we use, see foreign placenames"
Accenture,formerly Andersen Consulting; the new name was devised by an employee from “accent on the future”
access,has been known as contact since the 1989 Children Act
accession council,at which a new king or queen is formally proclaimed
accident,Take care in using this term in relation to traffic incidents; crash or collision may be better if the full circumstances are not known
"accommodate, accommodation",
accordion,not accordian
"achilles heel, achilles tendon",
acknowledgment,not acknowledgement
acres,"Use hectares, with acres in brackets, rounded up or down, eg the field measured 25 hectares (62 acres).You multiply hectares by 2.47 to convert to acres, or acres by 0.4 to convert to hectares"
acronyms,See  Abbreviations and acronyms
act,"uppercase when using the full name, eg Criminal Justice Act 1998, Official Secrets Act; but lowercase on second reference, eg “the act”, and when speaking in more general terms, eg “we need a radical freedom of information act”; bills remain lowercase until passed into law"
actor,"Use for both male and female actors; do not use actress except when in the name of an award, eg Oscar for best actress. The Guardian’s view is that actress comes into the same category as authoress, comedienne, manageress, “lady doctor”, “male nurse” and similar obsolete terms that date from a time when professions were largely the preserve of one sex (usually men). As Whoopi Goldberg put it in an interview with the paper: “An actress can only play a woman. I’m an actor – I can play anything.”There is normally no need to differentiate between the sexes – and if there is, the words male and female are perfectly adequate: Lady Gaga won a Brit in 2010 for best international female artist, not artiste, chanteuse, or songstress.As always, use common sense: a piece about the late film director Carlo Ponti was edited to say that in his early career he was “already a man with a good eye for pretty actors ...” As the readers’ editor pointed out in the subsequent clarification: “This was one of those occasions when the word ‘actresses’ might have been used”"
"AD, BC","AD goes before the date (AD64), BC goes after (300BC); both go after the century, eg second century AD, fourth century BC"
adaptation,not adaption
adapter,someone who adapts; adaptor plug
"adblocker, adblocking",
addendum,"plural  addendumsLatinate -um neuter endings that are a part of the language (eg stadium) take an -s plural. Exceptions: bacteria, which retain the Latin plural and take a plural verb, as do media, but note that spiritualists are mediums"
addresses,"like this: 90 York Way, London N1 9GU"
Adidas,"initial cap, although adidas is lc in the company logo"
administration,"the Obama administration, etc"
"admissible, inadmissible",not -able
admit,Take care – as a reader put it when we referred to Tory MPs who “admitted” being gay: “Admit in modern English is almost exclusively used when conceding or confessing something negative and/or of which one is or should be ashamed. Please be more careful. Language can offend.” Quite.The former Washington Post editor Ben Bradlee urged reporters not to “hide their biases and emotions behind subtly pejorative words” such as admit
ad nauseam,not ad nauseum
adoption,"Mention that children are adopted only when relevant to the story: a reader points out that “explicitly calling attention to adoptions in this way suggests that adoptionis not as good, and not as real a relationship, as having a child normally”. So say biological father, biological family rather than “real father”, “real family”, etc"
Adrenalin,TM; a brand of adrenaline
adrenaline,"hormone that increases heart rate and blood pressure, extracted from animals or synthesised for medical uses"
advance bookings,rather than “advanced bookings”. Or you could just say “bookings”
Advent calendar,
adverse,unfavourable;  averse  reluctant “He was averse to crossing the Irish Sea in such adverse conditions”
adviser,not advisor
Advisory Committee on Business Appointments (Acoba),
advocate,member of the Scottish bar (not a barrister)
aeroplane,in UK;  airplane  in US;  plane  works well anywhere
affect/effect,exhortations in the style guide had no effect (noun) on the number of mistakes; the level of mistakes was not affected (verb) by exhortations in the style guide; we hope to effect (verb) a change in this
affidavit,"a written declaration made on oath, so “sworn affidavit” is tautologous"
affinity,"with or between, not to or for"
Afghans,the people of Afghanistan
afghani,the currency of Afghanistan
aficionado,plural aficionados
Africa,"is a continent made up of more than 50 countries. When writing about people from those countries be sure to locate them precisely in their town, city, country etc. Avoid simply saying they are African or from Africa"
African American,
African-Caribbean,not Afro-Caribbean
Afrikaans,language
Afrikaner,person
Afrikander,cattle breed
afro,hairstyle
Afrobeat or Afrobeats?,"These are distinct music genres which often get mixed up. The first was pioneered by Fela Kuti in the 1960s and is a mix of west African musical styles, such as fuji music and highlife, with American funk and jazz; the second is a style of danceable 21st-century west African pop. The term “Afrobeats” has come to be used too widely and reductively in the media and it is preferable to refer to contemporary African artists’ particular genre (pop, dance music, etc)"
"afterlife, aftermath",
ageing,
ages,"Kamala Harris, 56 (not “aged 56”); Freddie Bawden Marsh, nine.a 62-year-old man; a 62-year-old; 62 years old.the woman was in her 20s (but twentysomething, thirtysomething, etc)Be clear when referring to age groups, such as the over-80s or under-16s, as sometimes these groupings don’t include the people who are actually 80 or 16; if the group does include them, a formulation such as 80 or over, or 16 and above can be clearer for readers. In headlines it is OK to use the shorter description when necessary"
agenda,"plural in origin, but singular in use: “agendum” is simply not on anyone’s agenda"
Age UK,charity formed by the merger of Age Concern and Help the Aged in 2009
aggravate,"Using this word to mean annoy, rather than make worse, really aggravates some people. Good. Both meanings have been around for more than 400 years, and there is no good reason why both should not be acceptable now .She only wanted to threaten him and aggravate him ... Wilkie Collins, The Woman in White (1860)"
AggregateIQ,
aggro,"abbreviation of aggravation, and spelt thus despite the once popular terrace chant “A, G, A-G-R, A-G-R-O: agro!”"
AGM,
a-ha,"band from Norway;  A-ha!  Alan Partridge catchphrase, quoting Abba’s Knowing Me, Knowing You"
ahead of,"overused, and often jars (“Why else would they hurriedly concoct their own ‘Confucius peace prize’, a day ahead of the ceremony in Oslo?” appeared in a leading article); before (which should have been used in this case) or in advance of are among the alternatives.The Press Association reported: “Hundreds gathered outside Lichfield Cathedral to witness the arrival of a horse-drawn carriage ahead of Stephen’s body ahead of his funeral”"
aide-de-camp,plural aides-de-camp (aide is a noun)
aide-memoire,plural aide-memoires (aide is a verb)
Aids,"acquired immune deficiency syndrome, but normally no need to spell out.Do not use such terms as “Aids victims” or someone “suffering from Aids”, language that in the words of one reader is “crass, inaccurate and reinforces stigma”, implying helplessness and inviting pity; “people with Aids” or “living with Aids” are preferable.Do not use the term “full-blown Aids”. Unesco guidelines state: “This term implies that there are varying stages of Aids ... People have Aids only when they present with an Aids-defining illness”"
"airbase, aircraft, aircrew, airdrop, airfield, airlift, airmail, airshow, airspace,","airstrike, airstrip, airtime"
"air fare, air force, air raid",
aircraft carrier,
aircraft designations,"usually with hyphens after initials, eg B-52, MiG-23"
Air Force One,US president’s jet
air hostess,"cabin attendant or flight attendant, please"
airports,"Heathrow, Gatwick, Stansted (normally no need to say airport); Liverpool John Lennon airport, Schiphol airport, etc"
air vice-marshal,
AKA,also known as
akimbo,See  arms akimbo
al-,(note lc and hyphen) before an Arabic name means “the” so try to avoid writing “the al- ...” where possible See  Arabic names
al-Aqsa Martyrs Brigade,
al-Aqsa mosque,"not the Aqsa mosque, or the al-Aqsa mosque. Not to be confused in pictures with the nearby Dome of the Rock. The mosque’s dome is silver-grey, whereas the Dome of the Rock, an Islamic shrine, has a large golden dome. Both buildings are located in occupied East Jerusalem, at the holy site known to Muslims as al-Haram al-Sharif, and to Jews as the Temple Mount, also sometimes referred to as al-Aqsa mosque compound"
Alastair or Alistair?,Alastair Campbell (spin doctor) Alastair Cook (cricketer) Alastair Hetherington (late Guardian editor) Alastair Stewart (broadcaster)Alistair Cooke (late BBC and Guardian journalist) Alistair Darling (politician) Alistair MacLean (late novelist) Alistair McGowan (impressionist)Aleister Crowley (late satanist)
albinism,"Avoid referring to people with albinism as albinos, instead say “a man with albinism” or “Jane Doe, who has albinism”"
"Albright, Madeleine",former US secretary of state
"Alcott, Louisa May",(1832-88) American author of Little Women
"Aléshé, Babátúndé",standup comedian
A-levels,
"Al Fayed, Mohamed",former owner of Harrods and Fulham FC (Fayed after first mention); the son who died in Paris in 1997 was Dodi Fayed
"Alfonsín, Raúl",(1927-2009) president of Argentina from 1983-89
alfresco,
algae,plural of alga
al-Hawl,not al-Hol for the camp in northern Syria
"al-Houthi, Abdulmalik",leader of the Houthi movement in Yemen. Call him Houthi at second mention
"Ali, Muhammad",was Cassius Clay until 1964
alibi,being somewhere else; not synonymous with excuse
alice band,"as worn by Alice in Lewis Carroll’s Through the Looking-Glass, and What Alice Found There (1871) and more recently David Beckham"
Alice books,"Alice’s Adventures in Wonderland, by Lewis Carroll (Charles Lutwidge Dodgson), was published in 1865; its sequel, which followed six years later, is called Through the Looking-Glass, and What Alice Found There. Note that they are not called “Alice in Wonderland” and “Alice Through the Looking- Glass”"
A-list,"etc, but to refer to “C-list celebrities” and its variations has become tedious. An edition of G2 referred to “D-list celebrities” and, less than hilariously, in a separate piece about the same reality TV show, “Z-list celebrities”"
Al Jazeera,
alkyl nitrite,not nitrate; commonly known as poppers
Allah,Arabic for “the God”. Both words refer to the same concept: there is no major difference between God in the Old Testament and Allah in Islam. Therefore it makes sense to talk about “God” in an Islamic context and to use “Allah” in quotations or for literary effect
Allahu Akbar,“God is greatest”
"Allawi, Ayad",Iraqi politician
"Allende, Isabel",Chilean author; her father was a cousin of Salvador Allende
"Allende, Salvador","Chilean president, overthrown and killed in 1973"
allies,"second world war allies, the allied invasion, etc"
all mouth and trousers,not “all mouth and no trousers”
all right,"has traditionally been regarded as right, and alright as not all right (although the 1965 Who song, much loved by generations of headline writers and still widely quoted today, was The Kids are Alright).Kingsley Amis in The King’s English said alright was “gross, crass, coarse and to be avoided” but admitted this was “a rule without a reason”.Note, however, the difference between “she got the answers all right” and “she got the answers, alright!”"
All Souls College,"Oxford, no apostrophe"
all together,as one united body: “We are all in it together”
altogether,"completely, totally: “That’s an altogether different matter”"
“alt-right”,"use once and in quotes at first mention; use far right at any subsequent mentions. Note: far right (noun) and far-right (adjective). More specific descriptions can be used where relevant when mentioning individuals associated with the movement, but such descriptions should be evidence-based."
"al-Maliki, Nouri",(not Nuri) became prime minister of Iraq in 2006
Almo,arm’s-length management organisation
"Almodóvar, Pedro",Spanish film-maker
alpha male,
al-Qaida,it means “the base”
al-Quds,"force of the Iranian Revolutionary Guard Corps; not Quds, Qods"
"al-Sadr, Moqtada","creator of the Mahdi army, or as the magazine Red Pepper described it: “Moqtada al- Sadr’s not-so-barmy army”"
alsatian,dog
Alsatian,person from Alsace
al-Shabaab,"Islamist insurgency group in Somalia; it means “the youth”. Singular, not plural"
also,often redundant
alter ego,"not “altar ego”, as we have been known to spell it"
alternative,"normally a choice between two courses of action; if there are more than two, option or choice may be preferred; beware the trend to use “alternate” instead of alternative: in a piece about French politics we wrote “in this juddering alternate reality …”"
"alumna (female), alumnus (male)","plural alumni, or alumnae for all-female institutions; in the UK graduate is preferable"
"al-Zaidi, Muntazer","Iraqi journalist who served a jail sentence for throwing his shoes at the then US president, George Bush"
Alzheimer’s disease,
Amazon,normally no need for com or co.uk
Amazon Prime,
Amazon Prime Video,"for the TV package, although these days it prefers to call itself simply Prime Video"
ambassador,"lc, eg the British ambassador to Washington; “ambassador, you are spoiling us” has become a headline cliche"
ambience,not ambiance
ambiguity,"a common problem in headlines when the subject is omitted from the past tense of a verb, as in this example from the paper:Westworld extras allegedly asked to participate in ‘graphic sexual situations’Did they allegedly ask, or were they allegedly asked? A simple “were” before “asked” would have fixed this.   Similarly:Labour warned of financial crash (did someone warn Labour of an impending crash, or did Labour warn someone else?)Tories paid millions to avoid tax Here not only does the reader have to ask whether the Tories paid millions or were paid millions, but also whether they paid millions of pounds or millions of people, and whether the Tories’ aim was to avoid tax or to enable the millions to avoid tax. This is very poor editing"
ambulance services,"These are NHS trusts, so lc for everything that is generic, eg London ambulance service, East of England ambulance service, South East Coast ambulance service"
amendments,"to the US constitution like this: fifth amendment, 18th amendment, etc"
"America, Americans","the country is generally the United States or US, although its citizens are Americans; we should remember that America includes all of North, Central and South America"
“America first”,A phrase  denounced by the Anti-Defamation League  for its links to 1940s Nazi sympathisers
American Civil Liberties Union,not American Civil Rights Union
American English,"Follow US spellings for proper nouns, eg Centers for Disease Control and Prevention, Department of Defense, Labor Day, One World Trade Center, Ann Arbor, Pearl Harbor, World Health Organization"
American universities,"Take care: “University of X” is not the same as “X University”; most states have two large public universities, eg University of Kentucky and Kentucky State University, University of Illinois and Illinois State University, etc.Do not call Johns Hopkins University “John Hopkins” or Stanford University “Stamford”"
America’s Cup,"sailing trophy named after the schooner America, its first winner"
Amhrán na bhFiann,Irish national anthem
Amicus,"trade union formed by a merger between the AEEU and MSF, now part of Unite after a further merger with the TGWU"
amid,"not amidst.“James warned, however, that the second half of the year was likely to prove more challenging overall amid a weak consumer backdrop.”Things fall  against  a backdrop, not amid one. If something is amid the backdrop, it’s part of it,  and thus completely unremarkable . Some cliches make the news sound tired; this one makes the news sound as if it’s not news at all"
amok,not amuck
among,not amongst
among or between?,"Whatever you may have been told, between is not limited to two parties. It is appropriate when the relationship is essentially reciprocal: fighting between the many peoples of Yugoslavia, treaties between European countries, etc; among belongs to distributive relationships: shared among, etc"
amount or number?,"amount refers to a quantity, number to something that can be counted, eg an enormous amount of energy was exerted by a small number of people"
ampersand,"Use in company names when the company does: Johnson & Johnson, Marks & Spencer, P&O, etc, but use “and” in the names of government departments and agencies: Department of Work and Pensions, Advanced Research and Invention Agency etc"
anaesthetic,
analysis,plural analyses
anarchism,"a political philosophy that advocates stateless societies, holding the state to be undesirable, unnecessary and harmful.The term “anarchist” is bandied about carelessly, often used by politicians and the media to denigrate opponents of the status quo, and should be used with care; “self- styled anarchist” should be avoided altogether"
ancestors,precede descendants; we frequently manage to get them the wrong way round
and/or,This is horrible. Make your mind up and say either “and” or “or” – whichever is more appropriate. The same applies to the phrase “if and when”
Andalucía,
Anderson shelter,not Andersen
… And You Will Know Us By The Trail Of Dead,
Angkor Wat,"Angkor Wat is only one of the 100 or so temples of Angkor, albeit the best known(“wat” means temple)"
Anglesey,"Always also include its Welsh name, Ynys Môn, possibly in brackets at first mention. Anglesey is the name of the island; Isle of Anglesey is the name of its county, which also includes nearby Holy Island, and Ynys Môn is the name of the UK parliament and Senedd constituency that covers the same area. Ynys Môn is the Welsh name for both the island and the county"
"anglicise, anglophile, anglophone",
animals,"pronoun “it” unless gender establishedAnimal breeds are usually lowercase, eg gloucestershire old spot, friesian, belted galloway, shetland pony, but note English longhorn, Welsh cob, British saddleback"
annex,verb; annexe noun; I am going to annex the annexe for the afternoon
anniversaries,"first anniversary, 10th anniversary etc; not one-year anniversary, 10-year anniversary. There is no such thing as a six-month anniversary"
anorexic,"is not a superlative of thin. Anorexia is an illness. Like schizophrenia, it should not be used as a cheap and lazy metaphor. Anyone who thinks of using a phrase such as “positively anorexic” should think again"
Ansaphone,TM; use answering machine or answerphone
antenatal,
antenna,(insect) plural antennae; (radio) plural antennas
anti-ballistic missile treaty,
antichrist,
anticipate,"Purists say this should not be used to mean expect, but expressions like “they did not anticipate any trouble” are now normal usage"
anticlimax,
antidepressants,
antidisestablishmentarianism,position adopted by those opposed to the disestablishment of the Church of England.Not a good headline word
antihero,
antimalarial,
"antipodean, antipodes",terms Australians themselves rarely use; avoid
"antisemitic, antisemitism",no hyphen: it does not mean “anti-Semitic”
antislavery,
antisocial,
anti-vaxxer,a person who is opposed to vaccinations
anti-war,
any more,Please do not say “anymore” any more
"ap Iorwerth, Rhun","leader of Plaid Cymru. Lowercase a, whether you include his first name or not. So: “Speaking in Cardiff, ap Iorwerth said …”"
apex,plural apexes
apostrofly,"“an insect that lands at random on the printed page, depositing an apostrophe wherever it lands” according to the Guardian’s former readers’ editor"
