Bold Text,Description
apostrophes,"used to indicate a missing letter or letters (can’t, we’d) or a possessive (David’s book).Don’t let anyone tell you that apostrophes don’t matter and we would be better off without them. Consider these four phrases, each of which means something different: my sister’s friend’s books (refers to one sister and her friend). my sister’s friends’ books (one sister with lots of friends). my sisters’ friend’s books (more than one sister, and their friend). my sisters’ friends’ books (more than one sister, and their friends).The possessive in words and names ending in S normally takes an apostrophe followed by a second S (Jones’s, James’s), but be guided by pronunciation and use the plural apostrophe where it helps: Mephistopheles’, Waters’, Hedges’ rather than Mephistopheles’s, Waters’s, Hedges’s.Plural nouns that do not end in S take an apostrophe and S in the possessive: children’s games, old folk’s home, people’s republic, etc.Phrases such as butcher’s knife, collector’s item, cow’s milk, goat’s cheese, pig’s blood, hangman’s noose, writer’s cramp, etc are treated as singular.Use apostrophes in phrases such as two days’ time, 12 years’ imprisonment and six weeks’ holiday, where the time period (two days) modifies a noun (time), but not in nine months pregnant or three weeks old, where the time period is adverbial (modifying an adjective such as pregnant or old) – if in doubt, test with a singular such as one day’s time, one month pregnant.Proper names that contain an apostrophe stay the same in the possessive: McDonald’s burgers may be delicious but Sainsbury’s are just as good.Some shops use an apostrophe, wrongly, to indicate a plural (“pea’s”), but will generally omit the apostrophe when one is actually required (“new seasons asparagus”), a phenomenon sometimes referred to as the greengrocer’s (or grocer’s) apostrophe. Try to avoid this"
app,"an application for, typically, a mobile phone"
appal,"but as the former Prince of Wales might have said, it really is appalling"
apparatchik,
appeal,"In British English you appeal against a decision, verdict, etc, you do not “appeal the verdict”. After we reported on 9 June 2010 that a convicted murderer “successfully appealed the sentence”, a despairing reader wrote: “This usage seems to be occurring more and more, sometimes even in headlines. Do Guardian journalists not read the style guide?” Not all of them, evidently"
appendix,plural appendices
Apple,no longer Apple Computer
apples,"lc: cox’s orange pippin, golden delicious, granny smith, etc"
appraise,to evaluate
apprise,to inform
April Fools’ Day,"also known, less commonly nowadays, as All Fools’ Day; an individual prank, or the victim of one, is an April fool, so you might say “one of the greatest April fools was the Guardian’s  San Serriffe issue of 1977  – it made April fools of all who were taken in”"
apropos,"Used most commonly to mean “with regard to”, it does not need a preposition, so “apropos your question ... “ But note the idiomatic “apropos of nothing ...” which means something like “changing the subject” or “incidentally”.Used to mean “pertinent” or “relevant to”, now rather rare, you might say “the thought was apropos to this” or, even more quaintly, “the point was apropos”.The French idiom “à propos de bottes” (“with regard to boots”), meaning without rhyme or reason, was used by, among others, George Orwell"
aquarium,plural aquariums
Arab,"Both a noun and an adjective, and the preferred adjective when referring to Arab things in general, eg Arab history, Arab traditions. Arabic usually refers to the language and literature: “the Arabic press” means newspapers written in Arabic, while “the Arab press” would include newspapers produced by Arabs in other languages.There is no simple definition of an Arab. At an international level, the 22 members of the Arab League can safely be described as Arab countries: Algeria, Bahrain, Comoros, Djibouti, Egypt, Iraq, Jordan, Kuwait, Lebanon, Libya, Mauritania, Morocco, Oman, Palestine, Qatar, Saudi Arabia, Somalia, Sudan, Syria, Tunisia, United Arab Emirates, and Yemen. At a human level, there are substantial groups within those countries – the Berbers of north Africa and the Kurds, for example – who do not regard themselves as Arabs."
Arabic names,"Though Arabic has only three vowels – a, i and u – it has several consonants that have no equivalent in the Roman alphabet. For instance, there are two kinds of s, d and t. There are also two glottal sounds. This means there are dozens of ways of writing the former Libyan leader Muammar Gaddafi’s name in English, and a reasonable argument can be made for adopting almost any of them. With no standard approach to transliteration agreed by the western media, we must try to balance consistency, comprehensibility and familiarity – which often puts a strain on all three.Typically, Arabs have at least three names. In some cases the first or second name may be the one that is most used, and this does not imply familiarity (Arabs often address foreigners politely as “Mr John” or “Dr David”). Often Arabs also havefamiliar names that have no connection with the names on their identity cards: a man might become known after the birth of his first son as “Abu Ahmad”, and a woman as “Umm Ahmad”, the father or mother of Ahmad (eg the Palestinian leader Ahmed Qureia is commonly known as Abu Ala).Where a particular spelling has become widely accepted through usage we should retain it. Where an individual with links to the west has clearly adopted a particular spelling of his or her own name, we should respect that. For breaking news and stories using names for which we have no established style, we take the lead given by Reuters wire copy.Note also that names in some parts of the Arab world have become gallicised, while others have become anglicised, eg the leading Egyptian film director Youssef Chahine uses a French spelling instead of the English transliteration, Shaheen.Some guidelines (for use particularly where there is no established transliteration)"
al-,"Means “the”. In names it is not capitalised, eg Ahmad al-Saqqaf, and can be dropped after the first mention (Mr Saqqaf). For placenames we drop it altogether. Sometimes it appears as as- or ash- or ad- or ul-: these should be ignored and can be safely rewritten as al-. But some Arabs, including Syrians and Egyptians, prefer to use el- in place of al-. Exceptions: by convention, Allah (al-Lah, literally “the God”) is written as one word and capitalised; and in Saudi royal names, Al Saud is correct (in this case, “al” is actually “aal” and does not mean “the”)."
"abdul, abu and bin","These are not self-contained names, but are connected to the name that follows: abdul means “slave of … “ and so cannot correctly be used on its own. There are standard combinations, “slave of the merciful one”, “slave of the generous one”, etc, which all indicate that the person is a servant of God. In transliteration, “abd” (slave) is lowercase, eg Ahmad abd al-Rahman al-Saqqaf, except when used at the start of a name; abu (father of) and bin (son of) are similar. When they appear in the middle of a name they should be lower case and are used in combination with the following part of the name: Faisal abu Ahmad al-Saqqaf, Faisal bin Ahmad al-Saqqaf. Despite the above, some people are actually known as “Abdul”. This is more common among non-Arab Muslims. And some Arabs run “abd” or “abu” into the following word, eg the writer Abdelrahman Munif."
Muhammad,"Our style for the prophet’s name and for most Muhammads living in Arab countries, though where someone’s preferred spelling is known we respect it, eg Mohamed Al Fayed, Mohamed ElBaradei"
"Muhandis/Mohandes, Qadi","Be wary of names where the first word is Muhandis or Qadi: these are honorary titles, meaning engineer and judge respectively"
European surnames of Arabic origin,"The guidelines above do not apply in examples such as the French labour minister, Myriam El Khomri. She is French born and only has one surname, which appears on her birth certificate and passport, written in the Latin alphabet; there is no other spelling. So she should be referred to as Myriam El Khomri at first mention and El Khomri thereafter.Similarly, the two 2016 Brussels airport suicide bombers, Ibrahim and Khalid El Bakraoui, were Belgian born. The Belgian legal system and prosecutors refer to them by the surname El Bakraoui, and we should too"
Arab spring,
Aran Island,"is off Co Donegal and the Aran Islands off Co Galway in western Ireland; the Isle of Arran is the largest island in the Firth of Clyde in Scotland. Aran sweaters, whether Irish or Scottish, come with an initial cap A"
arcane,esoteric;  archaic  antiquated
archbishops,"It is not normally necessary to use their formal title, which for both Anglicans and Catholics is Most Rev: so Justin Welby, the archbishop of Canterbury, at first mention, thereafter Welby or the archbishop (except in leading articles, where he is Mr Welby); Vincent Nichols, the archbishop of Westminster, on first mention, subsequently Nichols or the archbishop"
archdeacon,"the Ven Paul Olive, archdeacon of Farringdon, at first mention; thereafter Olive, or the archdeacon"
archery,"arrows are shot, rather than fired; and if they hit the centre of the target, it is a gold rather than a bullseye"
archetype or stereotype?,"An archetype is a perfect or typical specimen, an original model or pattern, or prototype.A stereotype is based on simplistic generalisations about a particular group. So the matriarch in a typical Woody Allen film might be described as a stereotypical, not archetypal, Jewish mother"
archipelago,plural archipelagos
architect or designer?,"The title of architect is protected under UK law and should only be used to describesomeone who is registered as such. If someone works on building design but is not registered as an architect they are most likely to be called a designer, eg Thomas Heatherwick"
arch-rival,an arch rival would mean something different
arctic fox,but Arctic Monkeys
Ardoyne,"(Belfast), not “the Ardoyne”"
area of outstanding natural beauty (AONB),
"Argentina, Argentinian",
arguably,unarguably one of the most overused words in the language
argyle sweater,
Armageddon,
"armed forces, armed services","the army, the British army, the navy, but Royal Navy, Royal Air Force or RAF"
armed forces ranks,see  military ranks
Armistice Day,but the armistice
arms akimbo,"hands on hips, elbows out; it is surprising how often the phrase “legs akimbo” turns up in the paper, “suggesting that such a posture exists, but lacks a word to define it”, as David McKie wrote.The radical theatre group in the BBC TV comedy series The League of Gentlemen was called Legz Akimbo"
army regiments,for a detailed guide to the organisation of the British army see  here
around,"about or approximately are better, eg “about £1m” or “approximately 2,000 people”"
around or round?,We were driving around aimlessly all weekend; it nearly drove me round the bend
arranged marriages,"are a traditional and perfectly acceptable form of wedlock across southern Asia and within the Asian community in Britain; they should not be confused with forced marriages, which are arranged without the consent of one or both partners, and have been widely criticised"
arse,British English;  ass  American English
arsing about,rather than arseing
art and architectural movements,"are generally lowercase, eg art deco, art nouveau, cubism, dadaism, expressionism, gothic, impressionism, pop art, romanesque, surrealism, etc, but note Bauhaus, Modern (in the sense of Modern British, to distinguish it from “modern art”, pre- Raphaelite, Romantic (to differentiate between a romantic painting and a Romantic painting)"
artefact,
artificial intelligence,AI on second mention and in headlines. Be careful not to overuse. An AI system is one able to improve from previous experiences or one created through training and learning rather than human coding or simple algorithms
artist,"not artiste (except, possibly, in a historical context)"
Arts and Crafts movement,
"Arts Council England, Arts Council of Wales, Creative Scotland",
as ... as,"“The hawthorn may be as old, if not older, than the stone tower of the windmill,” which appeared in the paper, should have read: “The hawthorn may be as old as, if not older than, the stone tower of the windmill.”A common error that is quite easy to spot if you try to read it without the phrase inside the commas: as old ... than (wrong); as old ... as (right)"
as or since?,"“As” is causal: I cannot check the online style guide as the connection is down; “since” is temporal: Luckily, I have had the latest edition of Guardian Style on my desk since it was published"
asbo,antisocial behaviour order
"ascendancy, ascendant",
Asean,Association of Southeast (sic) Asian Nations
Ash,Action on Smoking and Health
"Ashton, Catherine","The former EU foreign minister (strictly “high representative of the union for foreign affairs and security policy”) is Catherine Ashton at first mention, Lady Ashton at second mention, and thereafter simply Ashton"
Ashura,"a day of voluntary fasting for Muslims; Shia Muslims also commemorate the martyrdom of Hussein, a grandson of the prophet, so for them it is not a festival but a day of mourning"
Asio,"Australian Security and Intelligence Service, the country’s domestic counter- intelligence and security agency (the equivalent of Britain’s MI5)"
Asperger syndrome,"but it is acceptable to call it Asperger’s for short. Some people dislike the name because of the association with Hans Asperger, or consider it outdated, so it is better to use the broader term “autistic” unless you know a person prefers to say they have Asperger’s, in which case you should respect that preference.Do not use such witticisms as “Asperger-ish men”, which had to be removed from our website"
aspirin,
"al-Assad, Bashar","became president of Syria in 2000 after the death of his father, Hafez al-Assad"
"assassin, assassination","the murder of prominent political figures rather than, say, celebrities"
assisted dying,is preferable to “assisted suicide”
"astrologer, astrology",horoscopes
"astronomer, astronomy",telescopes
astronomer royal,currently Lord Rees
astronaut,someone who is trained for travelling in space
Asunción,capital of Paraguay
asylum seeker,"Someone seeking refugee status or humanitarian protection; there is no such thing as an “illegal asylum seeker”, a term the Press Complaints Commission ruled in breach of its code of practice.Refugees are people who have fled their home countries in fear for their lives, and may have been granted asylum under the 1951 refugee convention or qualify for humanitarian protection or discretionary leave, or have been granted exceptional leave to remain in Britain.Someone who is refused asylum should be referred to as a refused asylum seeker, not a “failed asylum seeker”.An asylum seeker can become an illegal immigrant only if he or she remains in Britain after having failed to respond to a removal notice"
Atacms,"for the missiles, not ATACMS. It’s short for army tactical missile system"
ATCU,"Associated Train Crew Union; not to be confused with ACTU, the Australian Council of Trade Unions"
athletics,"also known (particularly in the US) as track and field.1500m but 5,000m (the former is the “fifteen hundred” not “one thousand five hundred” metres)"
Atlantic Ocean,or just the Atlantic
attache,no accent
attention deficit hyperactivity disorder,ADHD after first mention
"Attlee, Clement","(1883-1967) Labour prime minister 1945-51, often misspelt as Atlee"
attorney general,"lc, no hyphen; plural  attorneys general"
auger,used to make holes
augur,predict or presage
Aum Shinrikyo,means Supreme Truth sect
Aung San Suu Kyi,"Use her full name (as with other Burmese names), even on second and subsequent mentions, in copy; if absolutely necessary, Suu Kyi is permissible in headlines"
Auntie,not Aunty if you must refer to the BBC in this way
au pair,
Auschwitz,"a Nazi death camp in German-occupied Poland, not a Polish death camp (see entry on “Polish death camps”)"
Australasia,Oceania is preferable.  See Oceania
Australian Labor party,not Labour
autism,"Autism is a neurodevelopmental condition, not an illness. Use only when referring to the condition, not as a term of abuse or in producing such witticisms as “mindless moral autism” and “Star Wars is a form of male autism”, both of which have appeared in the paper"
autistic people,"largely regard autism as a fundamental part of who they are, so dislike being described as having autism, or being people with autism/living with autism. Whenever possible, ask a person how they prefer to be described. (Further reading: National Autistic Society guidance on writing about autism )"
"autocorrect, autocomplete",but  auto-predict
Autocue,TM; teleprompter is a generic alternative
Auto-Tune,"TM; also Auto-Tuned, etc"
autumn,
autumn statement,
AV,the alternative vote electoral system
avant garde,no hyphen
"average, mean and median","Although we loosely refer to the “average” in many contexts (eg pay), there are two useful averages worth distinguishing.What is commonly known as the average is the mean: everyone’s wages are added up and divided by the number of wage earners. The median is described as “the value below which 50% of employees fall”, ie it is the wage earned by the middle person when everyone’s wages are lined up from smallest to largest. (For even numbers there are two middle people, but you calculate the mean average of their two wages.)The median is often a more useful guide than the mean, which can be distorted by figures at one extreme or the other"
awaken,"Say “I woke up”, “I was woken up” and so on because the forms starting with A are either considered wrong (“I was awoken”) or sound wrong (“I was awakened”). The US grammarian Bryan A Garner says: “The past-tense and past-participial forms of ‘wake’ and its various siblings are perhaps the most vexing in the language.”Exception: Star Wars: Episode VII – The Force Awakens"
awards and prizes,"are generally lc, eg Guardian first book award, Nobel peace prize (but note Academy Awards) lc for categories, eg Colin Firth won the best actor Oscar, Chipmunk was voted best newcomer at the 2008 Mobos, etc"
awol,"stands for “absent without leave” but, having been around since at least the 1920s, has established itself as a word in its own right"
awopbopaloobop alopbamboom,"from Little Richard’s Tutti Frutti (1955), a recording that has been described as “the sound of the birth of rock’n’roll”"
axing,"not axeing, but cutting jobs is less cliched than axing them"
axis,plural axes
Ayers Rock,is now  Uluru
Azerbaijan,"noun, Azerbaijani adjective; note that there are ethnic Azeris living in, for example, Armenia"
"Aznar, José María",former prime minister of Spain
